{
  "$schema": "lineage-v2.schema.json",
  "schema_version": 2,
  "generated_for": "Ruu active layout derived from the immutable ADR-080 flat package",
  "generated_on": "2026-09-08",
  "source_snapshot": {
    "path": "qualification/releases/adr-080-flat",
    "lineage_path": "QUALIFICATION-LINEAGE.json",
    "manifest_path": "MANIFEST.sha256",
    "manifest_sha256": "f56ee096ba2d11fcfc6f17e0182ae7b29858a5ec575d4b9fdf6c4616b23e6410"
  },
  "retention_policy": {
    "snapshot_is_immutable": true,
    "active_artifact_bytes_must_match_snapshot": true,
    "active_discovery_excludes": [
      "qualification/releases"
    ],
    "missing_historical_baseline_is_never_a_pass": true
  },
  "source_packages": {
    "adr070": {
      "package_sha256": "2d164a160e3a41e33633fdce564e6debfb7b42c8b78b015892cafa43951ac984",
      "manifest_sha256": "5c066c3cef81970f486f36f129860ee1d6906241118e13d04e33603d1f6f660f",
      "manifest_entries": 210,
      "role": "exact historical restoration source for state-space v2-v37 and retained Git smokes through ADR-070",
      "source_label": "ADR070 SOURCE PACKAGE"
    },
    "adr073": {
      "package_sha256": "4638e4d9edaa5b941c35ee41bdd364659fb588b830574f1865aa18a44c78277b",
      "manifest_sha256": "263c53f1c2a4b7715d1dfc31e67fec0fbec5583c73a35f8ac30c887501d0cd10",
      "manifest_entries": 137,
      "role": "exact historical restoration source for state-space v38 and ADR-071/072 observation/run-lock smokes",
      "source_label": "ADR073 SOURCE PACKAGE"
    },
    "adr080_pre_restoration": {
      "package_sha256": "b4b9f9a212b600be117efc7545459cf9f1671b08abb37e53b66b5f9b24a6e63a",
      "manifest_sha256": "f2ea00a9716d9bcce97f36a630017b203291579a0b0abe9fcd5896687022d5c5",
      "manifest_entries": 183,
      "role": "pre-restoration current source for state-space v39-v45 and current native/remote observation smokes",
      "source_label": "ADR080-PRE-RESTORATION SOURCE PACKAGE"
    }
  },
  "artifacts": [
    {
      "artifact_id": "git-checkpoint-canonicalization-smoke-v1-recorded-output",
      "kind": "git-smoke-recorded-output",
      "status": "RETAINED",
      "source": "adr070",
      "original_path": "git-checkpoint-canonicalization-smoke-v1.txt",
      "current_path": "qualification/git-smoke/checkpoint-canonicalization/git-checkpoint-canonicalization-smoke-v1.txt",
      "sha256": "c279abf3bdb62e12d75f42f87d6fc119e5a5e463a19c02b0c343483174bdba23"
    },
    {
      "artifact_id": "git-checkpoint-canonicalization-smoke-v1-script",
      "kind": "git-smoke-script",
      "status": "RETAINED",
      "source": "adr070",
      "original_path": "git-checkpoint-canonicalization-smoke-v1.sh",
      "current_path": "qualification/git-smoke/checkpoint-canonicalization/git-checkpoint-canonicalization-smoke-v1.sh",
      "sha256": "6789255f5ca3dfdeb1ec8b2e9e1b4dcbbdc41b0b94d98e021975275740eb95a4"
    },
    {
      "artifact_id": "git-direct-target-advance-smoke-v1-recorded-output",
      "kind": "git-smoke-recorded-output",
      "status": "RETAINED",
      "source": "adr070",
      "original_path": "git-direct-target-advance-smoke-v1.txt",
      "current_path": "qualification/git-smoke/direct-target-advance/git-direct-target-advance-smoke-v1.txt",
      "sha256": "6b3714ffc95425082f4512bd3a426a45215b37047b4f40e178575d3dd1e936a6"
    },
    {
      "artifact_id": "git-direct-target-advance-smoke-v1-script",
      "kind": "git-smoke-script",
      "status": "RETAINED",
      "source": "adr070",
      "original_path": "git-direct-target-advance-smoke-v1.sh",
      "current_path": "qualification/git-smoke/direct-target-advance/git-direct-target-advance-smoke-v1.sh",
      "sha256": "c7c1005980ba6466aa6b6c1c3204af891d1948bb0960e27b40eb2fa052bd3e66"
    },
    {
      "artifact_id": "git-group-local-correction-smoke-v1-recorded-output",
      "kind": "git-smoke-recorded-output",
      "status": "RETAINED",
      "source": "adr070",
      "original_path": "git-group-local-correction-smoke-v1.txt",
      "current_path": "qualification/git-smoke/group-local-correction/git-group-local-correction-smoke-v1.txt",
      "sha256": "9581c95c6a2b2e51018f48c21a1d34e399286f4f3a259f9d48bc16a9642bbadb"
    },
    {
      "artifact_id": "git-group-local-correction-smoke-v1-script",
      "kind": "git-smoke-script",
      "status": "RETAINED",
      "source": "adr070",
      "original_path": "git-group-local-correction-smoke-v1.sh",
      "current_path": "qualification/git-smoke/group-local-correction/git-group-local-correction-smoke-v1.sh",
      "sha256": "c5450bc56adc5433a532ec9317e94ba9b1a3478cae38446134cba72b2c111904"
    },
    {
      "artifact_id": "git-materialization-smoke-v1-recorded-output",
      "kind": "git-smoke-recorded-output",
      "status": "RETAINED",
      "source": "adr070",
      "original_path": "git-materialization-smoke-v1.txt",
      "current_path": "qualification/git-smoke/materialization/git-materialization-smoke-v1.txt",
      "sha256": "3bc01c2047bdb2e3438742e5af8461f4fa2d668499c028a00f6ecd0c09e7d9ef"
    },
    {
      "artifact_id": "git-materialization-smoke-v1-script",
      "kind": "git-smoke-script",
      "status": "RETAINED",
      "source": "adr070",
      "original_path": "git-materialization-smoke-v1.sh",
      "current_path": "qualification/git-smoke/materialization/git-materialization-smoke-v1.sh",
      "sha256": "aad317bd6351dbccbc7f4d67390d55a4e8817f2f30250a1c55050e7dce76cc74"
    },
    {
      "artifact_id": "git-native-observation-smoke-v2-recorded-output",
      "kind": "git-smoke-recorded-output",
      "status": "RETAINED",
      "source": "adr080_pre_restoration",
      "original_path": "git-native-observation-smoke-v2.txt",
      "current_path": "qualification/git-smoke/native-observation/git-native-observation-smoke-v2.txt",
      "sha256": "2097a4beee335d1451448b97fb26128e1496586ac07b06b3632f48123587a978"
    },
    {
      "artifact_id": "git-native-observation-smoke-v2-script",
      "kind": "git-smoke-script",
      "status": "RETAINED",
      "source": "adr080_pre_restoration",
      "original_path": "git-native-observation-smoke-v2.sh",
      "current_path": "qualification/git-smoke/native-observation/git-native-observation-smoke-v2.sh",
      "sha256": "16d578147180c068b34d7960bb466f38c96e804dca1183f9557b5b51b515aa66"
    },
    {
      "artifact_id": "git-native-observation-smoke-v3-recorded-output",
      "kind": "git-smoke-recorded-output",
      "status": "RETAINED",
      "source": "adr080_pre_restoration",
      "original_path": "git-native-observation-smoke-v3.txt",
      "current_path": "qualification/git-smoke/native-observation/git-native-observation-smoke-v3.txt",
      "sha256": "92028376d95f84c8282cc382f064f6bec2f3fa489c355de154617fc48a8720f6"
    },
    {
      "artifact_id": "git-native-observation-smoke-v3-script",
      "kind": "git-smoke-script",
      "status": "RETAINED",
      "source": "adr080_pre_restoration",
      "original_path": "git-native-observation-smoke-v3.sh",
      "current_path": "qualification/git-smoke/native-observation/git-native-observation-smoke-v3.sh",
      "sha256": "666f6fc06757a029039a49502ebf37ebbd08af33cd73c66863eb873929ef7f65"
    },
    {
      "artifact_id": "git-native-observation-smoke-v4-recorded-output",
      "kind": "git-smoke-recorded-output",
      "status": "RETAINED",
      "source": "adr080_pre_restoration",
      "original_path": "git-native-observation-smoke-v4.txt",
      "current_path": "qualification/git-smoke/native-observation/git-native-observation-smoke-v4.txt",
      "sha256": "e96cd7704913ec0f95d2cb637a8f8a6e344fa640191b3f39c0178bfc5902176b"
    },
    {
      "artifact_id": "git-native-observation-smoke-v4-script",
      "kind": "git-smoke-script",
      "status": "RETAINED",
      "source": "adr080_pre_restoration",
      "original_path": "git-native-observation-smoke-v4.sh",
      "current_path": "qualification/git-smoke/native-observation/git-native-observation-smoke-v4.sh",
      "sha256": "e5af57142369b2cba9c320f4d54c604e47d2edea070cab60c4d8f1f742b5da3b"
    },
    {
      "artifact_id": "git-native-observation-smoke-v5-recorded-output",
      "kind": "git-smoke-recorded-output",
      "status": "RETAINED",
      "source": "adr080_pre_restoration",
      "original_path": "git-native-observation-smoke-v5.txt",
      "current_path": "qualification/git-smoke/native-observation/git-native-observation-smoke-v5.txt",
      "sha256": "b4356bf172f05943cbcab9d1f22a230a3ee229c85e88644c7608de90d88ea8b6"
    },
    {
      "artifact_id": "git-native-observation-smoke-v5-script",
      "kind": "git-smoke-script",
      "status": "RETAINED",
      "source": "adr080_pre_restoration",
      "original_path": "git-native-observation-smoke-v5.sh",
      "current_path": "qualification/git-smoke/native-observation/git-native-observation-smoke-v5.sh",
      "sha256": "c61b89345b85f99dbe8fd349df161b824859ab61e63e8aafd22e9ca3b12eae0e"
    },
    {
      "artifact_id": "git-provider-realization-smoke-v1-recorded-output",
      "kind": "git-smoke-recorded-output",
      "status": "RETAINED",
      "source": "adr070",
      "original_path": "git-provider-realization-smoke-v1.txt",
      "current_path": "qualification/git-smoke/provider-realization/git-provider-realization-smoke-v1.txt",
      "sha256": "dc7ec931a9229d0ec870a11d26069aa54110f08b529221092116ac9e97f3df5c"
    },
    {
      "artifact_id": "git-provider-realization-smoke-v1-script",
      "kind": "git-smoke-script",
      "status": "RETAINED",
      "source": "adr070",
      "original_path": "git-provider-realization-smoke-v1.sh",
      "current_path": "qualification/git-smoke/provider-realization/git-provider-realization-smoke-v1.sh",
      "sha256": "fe9500d12a4f87bfe85a06de7be59821844b1163f78a999d1eb78ae43c557b18"
    },
    {
      "artifact_id": "git-provider-realization-smoke-v2-recorded-output",
      "kind": "git-smoke-recorded-output",
      "status": "RETAINED",
      "source": "adr070",